PrevBaro,CustomerInitMessage,SellerAnswer,CustomerFollowingMessage,Agreement,TemperamentCholeric,TemperamentPhlegmatic,TemperamentSanguine,TemperamentMelancholic
0.50,"Добрый день! че как у вас по качеству","Наш товар соответствует требованиям всех современных сертификатов качества","да, это полезно. соглашусь",0.85,0.25,1.00,0.35,1.00
0.85,"да, это полезно. соглашусь","В таком случае предлагаю вам приобрести наш товар. Мы можем предложить вам качественное обслуживание на протяжении длительного периода","я согласен, это интересно. Покупаю",1.00,0.25,1.00,0.85

0.50,"Добрый день! не понял, что вы там придумали","Ну не понял и пока","отстой",0.00,0.35,0.00,1.00,0.00

0.50,"Добрый день! интересует ваш товар","Наш товар хороший но не уверены, что он вам подойдёт","нет, тогда не буду покупать",0.00,0.40,0.50,0.25,0.75

0.50,"Добрый день! подскажите, что нам нужно для счастья?","Нет такого","тогда не интересует",0.00,0.25,0.50,1.00,1.00

0.50,"Добрый день! подскажите, что нужно для счастья?","Мы можем предложить наш товар по выгодной цене","интересно, а подскажите, пожалуйста, что можно придумать для интеграции вашего товара с моими системами",0.75,0.25,0.75,1.00,0.85
0.75,"интересно, а подскажите, пожалуйста, что можно придумать для интеграции вашего товара с моими системами","Мы можем предложить сервисное обслуживание при оплате полного пакета","что такое полный пакет?",0.75,0.25,0.85,0.50,0.50
0.75,"что такое полный пакет?","Полный пакет это интеграция всех систем управления и Мотивации","интересно",0.85,0.25,0.75,0.50,0.25
0.85,"интересно","Подскажите ваш адрес и мы сориентируем вас по доставке","улица пупкина дом залупкина",0.85,0.25,0.25,0.50,0.25
0.85,"улица пупкина дом залупкина","На ваш адрес мы можем доставить товар в течение дня","покупаю",1.00,0.25,0.25,0.50,0.25
